07:09:57.823984 IP _gateway.5359 > sepehr.ssh: Flags [.], ack 3954660396, win 4106, length 0
07:09:57.824713 IP sepehr.ssh > _gateway.5359: Flags [P.], seq 1:209, ack 0, win 3074, length 208
07:09:57.870675 IP _gateway.5359 > sepehr.ssh: Flags [.], ack 209, win 4105, length 0
07:09:58.050476 IP _gateway.54377 > sepehr.1234: Flags [S], seq 1654605411, win 64240, options [mss 1460,nop,wscale 8,nop,nop,sackOK], length 0
07:09:58.050510 IP sepehr.1234 > _gateway.54377: Flags [R.], seq 0, ack 1654605412, win 0, length 0
07:09:58.051603 IP _gateway.54378 > sepehr.1234: Flags [S], seq 825809146, win 64240, options [mss 1460,nop,wscale 8,nop,nop,sackOK], length 0
07:09:58.051626 IP sepehr.1234 > _gateway.54378: Flags [R.], seq 0, ack 825809147, win 0, length 0
07:09:58.155362 IP _gateway.57594 > sepehr.1234: Flags [S], seq 3803652163, win 8192, options [mss 1460,nop,nop,sackOK], length 0
07:09:58.155401 IP sepehr.1234 > _gateway.57594: Flags [R.], seq 0, ack 3803652164, win 0, length 0
07:09:58.156524 IP _gateway.57595 > sepehr.1234: Flags [S], seq 1126352297, win 8192, options [mss 1460,nop,wscale 8,nop,nop,sackOK], length 0
07:09:58.156540 IP sepehr.1234 > _gateway.57595: Flags [R.], seq 0, ack 1126352298, win 0, length 0
07:09:58.562454 IP _gateway.54378 > sepehr.1234: Flags [S], seq 825809146, win 64240, options [mss 1460,nop,wscale 8,nop,nop,sackOK], length 0
07:09:58.562489 IP sepehr.1234 > _gateway.54378: Flags [R.], seq 0, ack 1, win 0, length 0
07:09:58.658044 IP _gateway.57595 > sepehr.1234: Flags [S], seq 1126352297, win 8192, options [mss 1460,nop,wscale 8,nop,nop,sackOK], length 0
07:09:58.658068 IP sepehr.1234 > _gateway.57595: Flags [R.], seq 0, ack 1, win 0, length 0
07:09:58.829886 IP sepehr.39997 > pdc.qomstp.local.domain: 13538+ [1au] PTR? 155.1.168.192.in-addr.arpa. (55)
07:09:58.830248 ARP, Request who-has sepehr tell pdc.qomstp.local, length 46
07:09:58.830263 ARP, Reply sepehr is-at 00:50:56:b3:25:08 (oui Unknown), length 28
07:09:58.830356 IP pdc.qomstp.local.domain > sepehr.39997: 13538 NXDomain* 0/1/1 (139)
07:09:58.830459 IP sepehr.39997 > pdc.qomstp.local.domain: 13538+ PTR? 155.1.168.192.in-addr.arpa. (44)
07:09:58.830557 IP pdc.qomstp.local.domain > sepehr.39997: 13538 NXDomain* 0/1/0 (128)
07:09:58.831195 IP sepehr.38570 > pdc.qomstp.local.domain: 59689+ [1au] PTR? 4.1.168.192.in-addr.arpa. (53)
07:09:58.831327 IP pdc.qomstp.local.domain > sepehr.38570: 59689 NXDomain* 0/1/1 (137)
07:09:58.831408 IP sepehr.38570 > pdc.qomstp.local.domain: 59689+ PTR? 4.1.168.192.in-addr.arpa. (42)
07:09:58.831492 IP pdc.qomstp.local.domain > sepehr.38570: 59689 NXDomain* 0/1/0 (126)
07:09:59.072281 IP _gateway.54378 > sepehr.1234: Flags [S], seq 825809146, win 64240, options [mss 1460,nop,wscale 8,nop,nop,sackOK], length 0
07:09:59.072317 IP sepehr.1234 > _gateway.54378: Flags [R.], seq 0, ack 1, win 0, length 0
07:09:59.159951 IP _gateway.57595 > sepehr.1234: Flags [S], seq 1126352297, win 8192, options [mss 1460,nop,nop,sackOK], length 0
07:09:59.159988 IP sepehr.1234 > _gateway.57595: Flags [R.], seq 0, ack 1, win 0, length 0
07:09:59.161245 IP _gateway.57596 > sepehr.1234: Flags [S], seq 3981773502, win 8192, options [mss 1460,nop,wscale 8,nop,nop,sackOK], length 0
07:09:59.161258 IP sepehr.1234 > _gateway.57596: Flags [R.], seq 0, ack 3981773503, win 0, length 0
07:09:59.586269 IP _gateway.54378 > sepehr.1234: Flags [S], seq 825809146, win 64240, options [mss 1460,nop,wscale 8,nop,nop,sackOK], length 0
07:09:59.586309 IP sepehr.1234 > _gateway.54378: Flags [R.], seq 0, ack 1, win 0, length 0
07:09:59.662111 IP _gateway.57596 > sepehr.1234: Flags [S], seq 3981773502, win 8192, options [mss 1460,nop,wscale 8,nop,nop,sackOK], length 0
07:09:59.662146 IP sepehr.1234 > _gateway.57596: Flags [R.], seq 0, ack 1, win 0, length 0
07:10:00.100436 IP _gateway.54378 > sepehr.1234: Flags [S], seq 825809146, win 64240, options [mss 1460,nop,wscale 8,nop,nop,sackOK], length 0
07:10:00.100478 IP sepehr.1234 > _gateway.54378: Flags [R.], seq 0, ack 1, win 0, length 0
07:10:00.101500 IP _gateway.54379 > sepehr.1234: Flags [S], seq 3747056069, win 64240, options [mss 1460,nop,wscale 8,nop,nop,sackOK], length 0
07:10:00.101517 IP sepehr.1234 > _gateway.54379: Flags [R.], seq 0, ack 3747056070, win 0, length 0
07:10:00.163026 IP _gateway.57596 > sepehr.1234: Flags [S], seq 3981773502, win 8192, options [mss 1460,nop,nop,sackOK], length 0
07:10:00.163067 IP sepehr.1234 > _gateway.57596: Flags [R.], seq 0, ack 1, win 0, length 0
07:10:00.164433 IP _gateway.57597 > sepehr.1234: Flags [S], seq 2128747337, win 8192, options [mss 1460,nop,wscale 8,nop,nop,sackOK], length 0
07:10:00.164451 IP sepehr.1234 > _gateway.57597: Flags [R.], seq 0, ack 2128747338, win 0, length 0
07:10:00.616390 IP _gateway.54379 > sepehr.1234: Flags [S], seq 3747056069, win 64240, options [mss 1460,nop,wscale 8,nop,nop,sackOK], length 0
07:10:00.616429 IP sepehr.1234 > _gateway.54379: Flags [R.], seq 0, ack 1, win 0, length 0
07:10:00.666179 IP _gateway.57597 > sepehr.1234: Flags [S], seq 2128747337, win 8192, options [mss 1460,nop,wscale 8,nop,nop,sackOK], length 0
07:10:00.666218 IP sepehr.1234 > _gateway.57597: Flags [R.], seq 0, ack 1, win 0, length 0
07:10:01.127792 IP _gateway.54379 > sepehr.1234: Flags [S], seq 3747056069, win 64240, options [mss 1460,nop,wscale 8,nop,nop,sackOK], length 0
07:10:01.127826 IP sepehr.1234 > _gateway.54379: Flags [R.], seq 0, ack 1, win 0, length 0
07:10:01.166424 IP _gateway.57597 > sepehr.1234: Flags [S], seq 2128747337, win 8192, options [mss 1460,nop,nop,sackOK], length 0
07:10:01.166447 IP sepehr.1234 > _gateway.57597: Flags [R.], seq 0, ack 1, win 0, length 0
07:10:01.167777 IP _gateway.57598 > sepehr.1234: Flags [S], seq 3313101005, win 8192, options [mss 1460,nop,wscale 8,nop,nop,sackOK], length 0
07:10:01.167791 IP sepehr.1234 > _gateway.57598: Flags [R.], seq 0, ack 3313101006, win 0, length 0
07:10:01.641326 IP _gateway.54379 > sepehr.1234: Flags [S], seq 3747056069, win 64240, options [mss 1460,nop,wscale 8,nop,nop,sackOK], length 0
07:10:01.641362 IP sepehr.1234 > _gateway.54379: Flags [R.], seq 0, ack 1, win 0, length 0
07:10:01.668419 IP _gateway.57598 > sepehr.1234: Flags [S], seq 3313101005, win 8192, options [mss 1460,nop,wscale 8,nop,nop,sackOK], length 0
07:10:01.668437 IP sepehr.1234 > _gateway.57598: Flags [R.], seq 0, ack 1, win 0, length 0
07:10:02.153370 IP _gateway.54379 > sepehr.1234: Flags [S], seq 3747056069, win 64240, options [mss 1460,nop,wscale 8,nop,nop,sackOK], length 0
07:10:02.153409 IP sepehr.1234 > _gateway.54379: Flags [R.], seq 0, ack 1, win 0, length 0
07:10:02.154582 IP _gateway.54380 > sepehr.1234: Flags [S], seq 1737767811, win 64240, options [mss 1460,nop,wscale 8,nop,nop,sackOK], length 0
07:10:02.154599 IP sepehr.1234 > _gateway.54380: Flags [R.], seq 0, ack 1737767812, win 0, length 0
07:10:02.169504 IP _gateway.57598 > sepehr.1234: Flags [S], seq 3313101005, win 8192, options [mss 1460,nop,nop,sackOK], length 0
07:10:02.169516 IP sepehr.1234 > _gateway.57598: Flags [R.], seq 0, ack 1, win 0, length 0
07:10:02.170869 IP _gateway.57599 > sepehr.1234: Flags [S], seq 569640095, win 8192, options [mss 1460,nop,wscale 8,nop,nop,sackOK], length 0
07:10:02.170888 IP sepehr.1234 > _gateway.57599: Flags [R.], seq 0, ack 569640096, win 0, length 0
07:10:02.483089 ARP, Request who-has 192.168.1.151 tell 192.168.1.150, length 46
07:10:02.666975 IP _gateway.54380 > sepehr.1234: Flags [S], seq 1737767811, win 64240, options [mss 1460,nop,wscale 8,nop,nop,sackOK], length 0
07:10:02.667010 IP sepehr.1234 > _gateway.54380: Flags [R.], seq 0, ack 1, win 0, length 0
07:10:02.672313 IP _gateway.57599 > sepehr.1234: Flags [S], seq 569640095, win 8192, options [mss 1460,nop,wscale 8,nop,nop,sackOK], length 0
07:10:02.672327 IP sepehr.1234 > _gateway.57599: Flags [R.], seq 0, ack 1, win 0, length 0
07:10:02.925608 IP sepehr.47508 > pdc.qomstp.local.domain: 10932+ [1au] PTR? 151.1.168.192.in-addr.arpa. (55)
07:10:02.925860 IP pdc.qomstp.local.domain > sepehr.47508: 10932 NXDomain* 0/1/1 (139)
07:10:02.927560 IP sepehr.47508 > pdc.qomstp.local.domain: 10932+ PTR? 151.1.168.192.in-addr.arpa. (44)
07:10:02.927720 IP pdc.qomstp.local.domain > sepehr.47508: 10932 NXDomain* 0/1/0 (128)
07:10:02.928131 IP sepehr.56470 > pdc.qomstp.local.domain: 19279+ [1au] PTR? 150.1.168.192.in-addr.arpa. (55)
07:10:02.928306 IP pdc.qomstp.local.domain > sepehr.56470: 19279 NXDomain* 0/1/1 (139)
07:10:02.928362 IP sepehr.56470 > pdc.qomstp.local.domain: 19279+ PTR? 150.1.168.192.in-addr.arpa. (44)
07:10:02.928446 IP pdc.qomstp.local.domain > sepehr.56470: 19279 NXDomain* 0/1/0 (128)
07:10:03.174104 IP _gateway.57599 > sepehr.1234: Flags [S], seq 569640095, win 8192, options [mss 1460,nop,nop,sackOK], length 0
07:10:03.174141 IP sepehr.1234 > _gateway.57599: Flags [R.], seq 0, ack 1, win 0, length 0
07:10:03.175565 IP _gateway.57600 > sepehr.1234: Flags [S], seq 1563575832, win 8192, options [mss 1460,nop,wscale 8,nop,nop,sackOK], length 0
07:10:03.175578 IP sepehr.1234 > _gateway.57600: Flags [R.], seq 0, ack 1563575833, win 0, length 0
07:10:03.179060 IP _gateway.54380 > sepehr.1234: Flags [S], seq 1737767811, win 64240, options [mss 1460,nop,wscale 8,nop,nop,sackOK], length 0
07:10:03.179072 IP sepehr.1234 > _gateway.54380: Flags [R.], seq 0, ack 1, win 0, length 0
07:10:03.422162 ARP, Request who-has 192.168.1.151 tell 192.168.1.150, length 46
07:10:03.676670 IP _gateway.57600 > sepehr.1234: Flags [S], seq 1563575832, win 8192, options [mss 1460,nop,wscale 8,nop,nop,sackOK], length 0
07:10:03.676703 IP sepehr.1234 > _gateway.57600: Flags [R.], seq 0, ack 1, win 0, length 0
07:10:03.692323 IP _gateway.54380 > sepehr.1234: Flags [S], seq 1737767811, win 64240, options [mss 1460,nop,wscale 8,nop,nop,sackOK], length 0
07:10:03.692336 IP sepehr.1234 > _gateway.54380: Flags [R.], seq 0, ack 1, win 0, length 0
07:10:04.045009 ARP, Request who-has pdc.qomstp.local tell sepehr, length 28
07:10:04.045142 ARP, Reply pdc.qomstp.local is-at 00:0c:29:28:bf:5c (oui Unknown), length 46
07:10:04.178746 IP _gateway.57600 > sepehr.1234: Flags [S], seq 1563575832, win 8192, options [mss 1460,nop,nop,sackOK], length 0
07:10:04.178784 IP sepehr.1234 > _gateway.57600: Flags [R.], seq 0, ack 1, win 0, length 0
07:10:04.180147 IP _gateway.57601 > sepehr.1234: Flags [S], seq 3634057974, win 8192, options [mss 1460,nop,wscale 8,nop,nop,sackOK], length 0
07:10:04.180163 IP sepehr.1234 > _gateway.57601: Flags [R.], seq 0, ack 3634057975, win 0, length 0
07:10:04.193414 IP _gateway.54380 > sepehr.1234: Flags [S], seq 1737767811, win 64240, options [mss 1460,nop,wscale 8,nop,nop,sackOK], length 0
07:10:04.193431 IP sepehr.1234 > _gateway.54380: Flags [R.], seq 0, ack 1, win 0, length 0
07:10:04.194419 IP _gateway.54381 > sepehr.1234: Flags [S], seq 3359252852, win 64240, options [mss 1460,nop,wscale 8,nop,nop,sackOK], length 0
07:10:04.194434 IP sepehr.1234 > _gateway.54381: Flags [R.], seq 0, ack 3359252853, win 0, length 0
07:10:04.420564 ARP, Request who-has 192.168.1.151 tell 192.168.1.150, length 46
07:10:04.681539 IP _gateway.57601 > sepehr.1234: Flags [S], seq 3634057974, win 8192, options [mss 1460,nop,wscale 8,nop,nop,sackOK], length 0
07:10:04.681580 IP sepehr.1234 > _gateway.57601: Flags [R.], seq 0, ack 1, win 0, length 0
07:10:04.707096 IP _gateway.54381 > sepehr.1234: Flags [S], seq 3359252852, win 64240, options [mss 1460,nop,wscale 8,nop,nop,sackOK], length 0
07:10:04.707110 IP sepehr.1234 > _gateway.54381: Flags [R.], seq 0, ack 1, win 0, length 0
07:10:05.182633 IP _gateway.57601 > sepehr.1234: Flags [S], seq 3634057974, win 8192, options [mss 1460,nop,nop,sackOK], length 0
07:10:05.182667 IP sepehr.1234 > _gateway.57601: Flags [R.], seq 0, ack 1, win 0, length 0
07:10:05.184082 IP _gateway.57602 > sepehr.1234: Flags [S], seq 2751846362, win 8192, options [mss 1460,nop,wscale 8,nop,nop,sackOK], length 0
07:10:05.184102 IP sepehr.1234 > _gateway.57602: Flags [R.], seq 0, ack 2751846363, win 0, length 0
07:10:05.219723 IP _gateway.54381 > sepehr.1234: Flags [S], seq 3359252852, win 64240, options [mss 1460,nop,wscale 8,nop,nop,sackOK], length 0
07:10:05.219751 IP sepehr.1234 > _gateway.54381: Flags [R.], seq 0, ack 1, win 0, length 0
07:10:05.394418 ARP, Request who-has voipreport.qomstp.local tell _gateway, length 46
07:10:05.684762 IP _gateway.57602 > sepehr.1234: Flags [S], seq 2751846362, win 8192, options [mss 1460,nop,wscale 8,nop,nop,sackOK], length 0
07:10:05.684800 IP sepehr.1234 > _gateway.57602: Flags [R.], seq 0, ack 1, win 0, length 0
07:10:05.732534 IP _gateway.54381 > sepehr.1234: Flags [S], seq 3359252852, win 64240, options [mss 1460,nop,wscale 8,nop,nop,sackOK], length 0
07:10:05.732558 IP sepehr.1234 > _gateway.54381: Flags [R.], seq 0, ack 1, win 0, length 0
07:10:06.185910 IP _gateway.57602 > sepehr.1234: Flags [S], seq 2751846362, win 8192, options [mss 1460,nop,nop,sackOK], length 0
07:10:06.185950 IP sepehr.1234 > _gateway.57602: Flags [R.], seq 0, ack 1, win 0, length 0
07:10:06.187339 IP _gateway.57603 > sepehr.1234: Flags [S], seq 4133312260, win 8192, options [mss 1460,nop,wscale 8,nop,nop,sackOK], length 0
07:10:06.187361 IP sepehr.1234 > _gateway.57603: Flags [R.], seq 0, ack 4133312261, win 0, length 0
07:10:06.246396 IP _gateway.54381 > sepehr.1234: Flags [S], seq 3359252852, win 64240, options [mss 1460,nop,wscale 8,nop,nop,sackOK], length 0
07:10:06.246427 IP sepehr.1234 > _gateway.54381: Flags [R.], seq 0, ack 1, win 0, length 0
07:10:06.247431 IP _gateway.54382 > sepehr.1234: Flags [S], seq 3343439932, win 64240, options [mss 1460,nop,wscale 8,nop,nop,sackOK], length 0
07:10:06.247452 IP sepehr.1234 > _gateway.54382: Flags [R.], seq 0, ack 3343439933, win 0, length 0
07:10:06.336614 ARP, Request who-has 192.168.1.81 tell _gateway, length 46
07:10:06.393183 ARP, Request who-has voipreport.qomstp.local tell _gateway, length 46
07:10:06.688756 IP _gateway.57603 > sepehr.1234: Flags [S], seq 4133312260, win 8192, options [mss 1460,nop,wscale 8,nop,nop,sackOK], length 0
07:10:06.688786 IP sepehr.1234 > _gateway.57603: Flags [R.], seq 0, ack 1, win 0, length 0
07:10:06.748447 IP _gateway.54382 > sepehr.1234: Flags [S], seq 3343439932, win 64240, options [mss 1460,nop,wscale 8,nop,nop,sackOK], length 0
07:10:06.748477 IP sepehr.1234 > _gateway.54382: Flags [R.], seq 0, ack 1, win 0, length 0
07:10:07.021449 IP sepehr.37233 > pdc.qomstp.local.domain: 28786+ [1au] PTR? 81.1.168.192.in-addr.arpa. (54)
07:10:07.021688 IP pdc.qomstp.local.domain > sepehr.37233: 28786 NXDomain* 0/1/1 (138)
07:10:07.021780 IP sepehr.37233 > pdc.qomstp.local.domain: 28786+ PTR? 81.1.168.192.in-addr.arpa. (43)
07:10:07.021929 IP pdc.qomstp.local.domain > sepehr.37233: 28786 NXDomain* 0/1/0 (127)
07:10:07.189824 IP _gateway.57603 > sepehr.1234: Flags [S], seq 4133312260, win 8192, options [mss 1460,nop,nop,sackOK], length 0
07:10:07.189857 IP sepehr.1234 > _gateway.57603: Flags [R.], seq 0, ack 1, win 0, length 0
07:10:07.191230 IP _gateway.57604 > sepehr.1234: Flags [S], seq 1712539749, win 8192, options [mss 1460,nop,wscale 8,nop,nop,sackOK], length 0
07:10:07.191241 IP sepehr.1234 > _gateway.57604: Flags [R.], seq 0, ack 1712539750, win 0, length 0
07:10:07.262094 IP _gateway.54382 > sepehr.1234: Flags [S], seq 3343439932, win 64240, options [mss 1460,nop,wscale 8,nop,nop,sackOK], length 0
07:10:07.262122 IP sepehr.1234 > _gateway.54382: Flags [R.], seq 0, ack 1, win 0, length 0
07:10:07.393036 ARP, Request who-has voipreport.qomstp.local tell _gateway, length 46
07:10:07.691724 IP _gateway.57604 > sepehr.1234: Flags [S], seq 1712539749, win 8192, options [mss 1460,nop,wscale 8,nop,nop,sackOK], length 0
07:10:07.691755 IP sepehr.1234 > _gateway.57604: Flags [R.], seq 0, ack 1, win 0, length 0
07:10:07.775625 IP _gateway.54382 > sepehr.1234: Flags [S], seq 3343439932, win 64240, options [mss 1460,nop,wscale 8,nop,nop,sackOK], length 0
07:10:07.775655 IP sepehr.1234 > _gateway.54382: Flags [R.], seq 0, ack 1, win 0, length 0
07:10:07.871287 IP _gateway.9912 > sepehr.ssh: Flags [P.], seq 41737734:41737846, ack 129397341, win 32768, length 112
07:10:07.871745 IP sepehr.ssh > _gateway.9912: Flags [P.], seq 1:81, ack 112, win 501, length 80
07:10:07.872119 IP _gateway.9912 > sepehr.ssh: Flags [P.], seq 112:224, ack 81, win 32767, length 112
07:10:07.872354 IP sepehr.ssh > _gateway.9912: Flags [P.], seq 81:161, ack 224, win 501, length 80
07:10:07.873030 IP _gateway.9912 > sepehr.ssh: Flags [P.], seq 224:320, ack 161, win 32766, length 96
07:10:07.873223 IP sepehr.ssh > _gateway.9912: Flags [P.], seq 161:273, ack 320, win 501, length 112
07:10:07.873826 IP _gateway.9912 > sepehr.ssh: Flags [P.], seq 320:432, ack 273, win 32765, length 112
07:10:07.876926 IP sepehr.ssh > _gateway.9912: Flags [P.], seq 273:833, ack 432, win 501, length 560
07:10:07.877103 IP sepehr.ssh > _gateway.9912: Flags [P.], seq 833:913, ack 432, win 501, length 80
07:10:07.877321 IP _gateway.9912 > sepehr.ssh: Flags [.], ack 913, win 32760, length 0
07:10:08.193005 IP _gateway.57604 > sepehr.1234: Flags [S], seq 1712539749, win 8192, options [mss 1460,nop,nop,sackOK], length 0
07:10:08.193044 IP sepehr.1234 > _gateway.57604: Flags [R.], seq 0, ack 1, win 0, length 0
07:10:08.194311 IP _gateway.57605 > sepehr.1234: Flags [S], seq 60137791, win 8192, options [mss 1460,nop,wscale 8,nop,nop,sackOK], length 0
07:10:08.194330 IP sepehr.1234 > _gateway.57605: Flags [R.], seq 0, ack 60137792, win 0, length 0
07:10:08.289391 IP _gateway.54382 > sepehr.1234: Flags [S], seq 3343439932, win 64240, options [mss 1460,nop,wscale 8,nop,nop,sackOK], length 0
07:10:08.289426 IP sepehr.1234 > _gateway.54382: Flags [R.], seq 0, ack 1, win 0, length 0
07:10:08.290719 IP _gateway.54383 > sepehr.1234: Flags [S], seq 1169885314, win 64240, options [mss 1460,nop,wscale 8,nop,nop,sackOK], length 0
07:10:08.290735 IP sepehr.1234 > _gateway.54383: Flags [R.], seq 0, ack 1169885315, win 0, length 0
07:10:08.393179 ARP, Request who-has voipreport.qomstp.local tell _gateway, length 46
07:10:08.694963 IP _gateway.57605 > sepehr.1234: Flags [S], seq 60137791, win 8192, options [mss 1460,nop,wscale 8,nop,nop,sackOK], length 0
07:10:08.695002 IP sepehr.1234 > _gateway.57605: Flags [R.], seq 0, ack 1, win 0, length 0
07:10:08.774139 IP _gateway.53000 > sepehr.ssh: Flags [S], seq 199975362, win 29200, options [mss 1400,sackOK,TS val 1488760624 ecr 0,nop,wscale 7], length 0
07:10:08.774173 IP sepehr.ssh > _gateway.53000: Flags [S.], seq 1965550856, ack 199975363, win 65160, options [mss 1460,sackOK,TS val 4277069133 ecr 1488760624,nop,wscale 7], length 0
07:10:08.802582 IP _gateway.54383 > sepehr.1234: Flags [S], seq 1169885314, win 64240, options [mss 1460,nop,wscale 8,nop,nop,sackOK], length 0
07:10:08.802609 IP sepehr.1234 > _gateway.54383: Flags [R.], seq 0, ack 1, win 0, length 0
07:10:09.000688 ARP, Request who-has 192.168.1.151 tell 192.168.1.150, length 46
07:10:09.141467 IP _gateway.9912 > sepehr.ssh: Flags [P.], seq 432:544, ack 913, win 32760, length 112
07:10:09.141752 IP sepehr.ssh > _gateway.9912: Flags [P.], seq 913:993, ack 544, win 501, length 80
07:10:09.142518 IP _gateway.9912 > sepehr.ssh: Flags [P.], seq 544:640, ack 993, win 32760, length 96
07:10:09.142653 IP sepehr.ssh > _gateway.9912: Flags [P.], seq 993:1105, ack 640, win 501, length 112
07:10:09.143317 IP _gateway.9912 > sepehr.ssh: Flags [P.], seq 640:752, ack 1105, win 32759, length 112
07:10:09.146157 IP sepehr.ssh > _gateway.9912: Flags [P.], seq 1105:1393, ack 752, win 501, length 288
07:10:09.146340 IP sepehr.ssh > _gateway.9912: Flags [P.], seq 1393:1473, ack 752, win 501, length 80
07:10:09.146558 IP _gateway.9912 > sepehr.ssh: Flags [.], ack 1473, win 32768, length 0
07:10:09.196076 IP _gateway.57605 > sepehr.1234: Flags [S], seq 60137791, win 8192, options [mss 1460,nop,nop,sackOK], length 0
07:10:09.196107 IP sepehr.1234 > _gateway.57605: Flags [R.], seq 0, ack 1, win 0, length 0
07:10:09.197420 IP _gateway.57606 > sepehr.1234: Flags [S], seq 4116049000, win 8192, options [mss 1460,nop,wscale 8,nop,nop,sackOK], length 0
07:10:09.197428 IP sepehr.1234 > _gateway.57606: Flags [R.], seq 0, ack 4116049001, win 0, length 0
07:10:09.317120 IP _gateway.54383 > sepehr.1234: Flags [S], seq 1169885314, win 64240, options [mss 1460,nop,wscale 8,nop,nop,sackOK], length 0
07:10:09.317152 IP sepehr.1234 > _gateway.54383: Flags [R.], seq 0, ack 1, win 0, length 0
07:10:09.392793 ARP, Request who-has voipreport.qomstp.local tell _gateway, length 46
07:10:09.698370 IP _gateway.57606 > sepehr.1234: Flags [S], seq 4116049000, win 8192, options [mss 1460,nop,wscale 8,nop,nop,sackOK], length 0
07:10:09.698406 IP sepehr.1234 > _gateway.57606: Flags [R.], seq 0, ack 1, win 0, length 0
07:10:09.809005 IP sepehr.ssh > _gateway.53000: Flags [S.], seq 1965550856, ack 199975363, win 65160, options [mss 1460,sackOK,TS val 4277070168 ecr 1488760624,nop,wscale 7], length 0
07:10:09.818072 IP _gateway.54383 > sepehr.1234: Flags [S], seq 1169885314, win 64240, options [mss 1460,nop,wscale 8,nop,nop,sackOK], length 0
07:10:09.818094 IP sepehr.1234 > _gateway.54383: Flags [R.], seq 0, ack 1, win 0, length 0
07:10:09.927324 ARP, Request who-has 192.168.1.151 tell 192.168.1.150, length 46
07:10:10.120953 IP _gateway.53000 > sepehr.ssh: Flags [.], ack 1, win 229, options [nop,nop,TS val 1488761971 ecr 4277069133], length 0
07:10:10.127413 IP _gateway.5359 > sepehr.ssh: Flags [P.], seq 0:48, ack 209, win 4105, length 48
07:10:10.135394 IP sepehr.ssh > _gateway.53000: Flags [P.], seq 1:43, ack 1, win 510, options [nop,nop,TS val 4277070494 ecr 1488760624], length 42
07:10:10.181008 IP sepehr.ssh > _gateway.5359: Flags [.], ack 48, win 3074, length 0
07:10:10.200339 IP _gateway.57606 > sepehr.1234: Flags [S], seq 4116049000, win 8192, options [mss 1460,nop,nop,sackOK], length 0
07:10:10.200362 IP sepehr.1234 > _gateway.57606: Flags [R.], seq 0, ack 1, win 0, length 0
07:10:10.201705 IP _gateway.57607 > sepehr.1234: Flags [S], seq 1032269559, win 8192, options [mss 1460,nop,wscale 8,nop,nop,sackOK], length 0
07:10:10.201726 IP sepehr.1234 > _gateway.57607: Flags [R.], seq 0, ack 1032269560, win 0, length 0
07:10:10.332636 IP _gateway.54383 > sepehr.1234: Flags [S], seq 1169885314, win 64240, options [mss 1460,nop,wscale 8,nop,nop,sackOK], length 0
07:10:10.332667 IP sepehr.1234 > _gateway.54383: Flags [R.], seq 0, ack 1, win 0, length 0
07:10:10.333693 IP _gateway.54384 > sepehr.1234: Flags [S], seq 3596234778, win 64240, options [mss 1460,nop,wscale 8,nop,nop,sackOK], length 0
07:10:10.333703 IP sepehr.1234 > _gateway.54384: Flags [R.], seq 0, ack 3596234779, win 0, length 0
07:10:10.392685 ARP, Request who-has voipreport.qomstp.local tell _gateway, length 46
07:10:10.692089 IP _gateway.53000 > sepehr.ssh: Flags [P.], seq 23:999, ack 43, win 229, options [nop,nop,TS val 1488762542 ecr 4277070494], length 976
07:10:10.692118 IP sepehr.ssh > _gateway.53000: Flags [.], ack 1, win 510, options [nop,nop,TS val 4277071051 ecr 1488760624,nop,nop,sack 1 {23:999}], length 0
07:10:10.702505 IP _gateway.57607 > sepehr.1234: Flags [S], seq 1032269559, win 8192, options [mss 1460,nop,wscale 8,nop,nop,sackOK], length 0
07:10:10.702528 IP sepehr.1234 > _gateway.57607: Flags [R.], seq 0, ack 1, win 0, length 0
07:10:10.790787 IP _gateway.9912 > sepehr.ssh: Flags [P.], seq 752:944, ack 1473, win 32768, length 192
07:10:10.791594 IP sepehr.ssh > _gateway.9912: Flags [P.], seq 1473:1553, ack 944, win 501, length 80
07:10:10.791966 IP _gateway.9912 > sepehr.ssh: Flags [P.], seq 944:1008, ack 1553, win 32767, length 64
07:10:10.794389 IP sepehr.ssh > _gateway.9912: Flags [P.], seq 1553:1633, ack 1008, win 501, length 80
07:10:10.794680 IP _gateway.9912 > sepehr.ssh: Flags [P.], seq 1008:1072, ack 1633, win 32766, length 64
07:10:10.794811 IP sepehr.ssh > _gateway.9912: Flags [P.], seq 1633:1713, ack 1072, win 501, length 80
07:10:10.798814 IP _gateway.9912 > sepehr.ssh: Flags [P.], seq 1072:1136, ack 1713, win 32766, length 64
07:10:10.799091 IP sepehr.ssh > _gateway.9912: Flags [P.], seq 1713:9013, ack 1136, win 501, length 7300
07:10:10.799114 IP sepehr.ssh > _gateway.9912: Flags [P.], seq 9013:16313, ack 1136, win 501, length 7300
07:10:10.799726 IP _gateway.9912 > sepehr.ssh: Flags [.], ack 4633, win 32768, length 0
07:10:10.799749 IP sepehr.ssh > _gateway.9912: Flags [P.], seq 16313:19233, ack 1136, win 501, length 2920
07:10:10.799960 IP _gateway.9912 > sepehr.ssh: Flags [.], ack 7553, win 32768, length 0
07:10:10.800207 IP _gateway.9912 > sepehr.ssh: Flags [.], ack 10473, win 32768, length 0
07:10:10.800221 IP sepehr.ssh > _gateway.9912: Flags [P.], seq 19233:22321, ack 1136, win 501, length 3088
07:10:10.800451 IP _gateway.9912 > sepehr.ssh: Flags [.], ack 13393, win 32768, length 0
07:10:10.800708 IP _gateway.9912 > sepehr.ssh: Flags [.], ack 16313, win 32768, length 0
07:10:10.800948 IP _gateway.9912 > sepehr.ssh: Flags [.], ack 19233, win 32768, length 0
07:10:10.801191 IP _gateway.9912 > sepehr.ssh: Flags [.], ack 22153, win 32768, length 0
07:10:10.801847 IP _gateway.9912 > sepehr.ssh: Flags [P.], seq 1136:1200, ack 22321, win 32766, length 64
07:10:10.802266 IP sepehr.ssh > _gateway.9912: Flags [P.], seq 22321:22401, ack 1200, win 501, length 80
07:10:10.845744 IP _gateway.54384 > sepehr.1234: Flags [S], seq 3596234778, win 64240, options [mss 1460,nop,wscale 8,nop,nop,sackOK], length 0
07:10:10.845780 IP sepehr.1234 > _gateway.54384: Flags [R.], seq 0, ack 1, win 0, length 0
07:10:10.846798 IP _gateway.9912 > sepehr.ssh: Flags [.], ack 22401, win 32766, length 0
07:10:10.925725 ARP, Request who-has 192.168.1.151 tell 192.168.1.150, length 46
07:10:11.204054 IP _gateway.57607 > sepehr.1234: Flags [S], seq 1032269559, win 8192, options [mss 1460,nop,nop,sackOK], length 0
07:10:11.204088 IP sepehr.1234 > _gateway.57607: Flags [R.], seq 0, ack 1, win 0, length 0
07:10:11.205301 IP _gateway.57608 > sepehr.1234: Flags [S], seq 1181577246, win 8192, options [mss 1460,nop,wscale 8,nop,nop,sackOK], length 0
07:10:11.205320 IP sepehr.1234 > _gateway.57608: Flags [R.], seq 0, ack 1181577247, win 0, length 0
07:10:11.347508 IP _gateway.54384 > sepehr.1234: Flags [S], seq 3596234778, win 64240, options [mss 1460,nop,wscale 8,nop,nop,sackOK], length 0
07:10:11.347539 IP sepehr.1234 > _gateway.54384: Flags [R.], seq 0, ack 1, win 0, length 0
07:10:11.706815 IP _gateway.57608 > sepehr.1234: Flags [S], seq 1181577246, win 8192, options [mss 1460,nop,wscale 8,nop,nop,sackOK], length 0
07:10:11.706848 IP sepehr.1234 > _gateway.57608: Flags [R.], seq 0, ack 1, win 0, length 0
07:10:11.861060 IP _gateway.54384 > sepehr.1234: Flags [S], seq 3596234778, win 64240, options [mss 1460,nop,wscale 8,nop,nop,sackOK], length 0
07:10:11.861093 IP sepehr.1234 > _gateway.54384: Flags [R.], seq 0, ack 1, win 0, length 0
07:10:12.002190 ARP, Request who-has 192.168.1.151 tell 192.168.1.150, length 46
07:10:12.207926 IP _gateway.57608 > sepehr.1234: Flags [S], seq 1181577246, win 8192, options [mss 1460,nop,nop,sackOK], length 0
07:10:12.207958 IP sepehr.1234 > _gateway.57608: Flags [R.], seq 0, ack 1, win 0, length 0
07:10:12.209324 IP _gateway.57609 > sepehr.1234: Flags [S], seq 4104671053, win 8192, options [mss 1460,nop,wscale 8,nop,nop,sackOK], length 0
07:10:12.209344 IP sepehr.1234 > _gateway.57609: Flags [R.], seq 0, ack 4104671054, win 0, length 0
07:10:12.375742 IP _gateway.54384 > sepehr.1234: Flags [S], seq 3596234778, win 64240, options [mss 1460,nop,wscale 8,nop,nop,sackOK], length 0
07:10:12.375781 IP sepehr.1234 > _gateway.54384: Flags [R.], seq 0, ack 1, win 0, length 0
07:10:12.376844 IP _gateway.54385 > sepehr.1234: Flags [S], seq 2774575446, win 64240, options [mss 1460,nop,wscale 8,nop,nop,sackOK], length 0
07:10:12.376858 IP sepehr.1234 > _gateway.54385: Flags [R.], seq 0, ack 2774575447, win 0, length 0
07:10:12.710551 IP _gateway.57609 > sepehr.1234: Flags [S], seq 4104671053, win 8192, options [mss 1460,nop,wscale 8,nop,nop,sackOK], length 0
07:10:12.710583 IP sepehr.1234 > _gateway.57609: Flags [R.], seq 0, ack 1, win 0, length 0
07:10:12.877747 IP _gateway.54385 > sepehr.1234: Flags [S], seq 2774575446, win 64240, options [mss 1460,nop,wscale 8,nop,nop,sackOK], length 0
07:10:12.877782 IP sepehr.1234 > _gateway.54385: Flags [R.], seq 0, ack 1, win 0, length 0
07:10:12.922544 ARP, Request who-has 192.168.1.151 tell 192.168.1.150, length 46
07:10:13.211714 IP _gateway.57609 > sepehr.1234: Flags [S], seq 4104671053, win 8192, options [mss 1460,nop,nop,sackOK], length 0
07:10:13.211753 IP sepehr.1234 > _gateway.57609: Flags [R.], seq 0, ack 1, win 0, length 0
07:10:13.213140 IP _gateway.57610 > sepehr.1234: Flags [S], seq 4257295881, win 8192, options [mss 1460,nop,wscale 8,nop,nop,sackOK], length 0
07:10:13.213163 IP sepehr.1234 > _gateway.57610: Flags [R.], seq 0, ack 4257295882, win 0, length 0
07:10:13.391312 IP _gateway.54385 > sepehr.1234: Flags [S], seq 2774575446, win 64240, options [mss 1460,nop,wscale 8,nop,nop,sackOK], length 0
07:10:13.391349 IP sepehr.1234 > _gateway.54385: Flags [R.], seq 0, ack 1, win 0, length 0
07:10:13.713896 IP _gateway.57610 > sepehr.1234: Flags [S], seq 4257295881, win 8192, options [mss 1460,nop,wscale 8,nop,nop,sackOK], length 0
07:10:13.713932 IP sepehr.1234 > _gateway.57610: Flags [R.], seq 0, ack 1, win 0, length 0
07:10:13.906664 IP _gateway.54385 > sepehr.1234: Flags [S], seq 2774575446, win 64240, options [mss 1460,nop,wscale 8,nop,nop,sackOK], length 0
07:10:13.906694 IP sepehr.1234 > _gateway.54385: Flags [R.], seq 0, ack 1, win 0, length 0
07:10:13.920931 ARP, Request who-has 192.168.1.151 tell 192.168.1.150, length 46
07:10:14.215391 IP _gateway.57610 > sepehr.1234: Flags [S], seq 4257295881, win 8192, options [mss 1460,nop,nop,sackOK], length 0
07:10:14.215430 IP sepehr.1234 > _gateway.57610: Flags [R.], seq 0, ack 1, win 0, length 0
07:10:14.216657 IP _gateway.57611 > sepehr.1234: Flags [S], seq 1177338768, win 8192, options [mss 1460,nop,wscale 8,nop,nop,sackOK], length 0
07:10:14.216670 IP sepehr.1234 > _gateway.57611: Flags [R.], seq 0, ack 1177338769, win 0, length 0
07:10:14.419194 IP _gateway.54385 > sepehr.1234: Flags [S], seq 2774575446, win 64240, options [mss 1460,nop,wscale 8,nop,nop,sackOK], length 0
07:10:14.419229 IP sepehr.1234 > _gateway.54385: Flags [R.], seq 0, ack 1, win 0, length 0
07:10:14.420627 IP _gateway.54386 > sepehr.1234: Flags [S], seq 3326609923, win 64240, options [mss 1460,nop,wscale 8,nop,nop,sackOK], length 0
07:10:14.420651 IP sepehr.1234 > _gateway.54386: Flags [R.], seq 0, ack 3326609924, win 0, length 0
07:10:14.717912 IP _gateway.57611 > sepehr.1234: Flags [S], seq 1177338768, win 8192, options [mss 1460,nop,wscale 8,nop,nop,sackOK], length 0
07:10:14.717952 IP sepehr.1234 > _gateway.57611: Flags [R.], seq 0, ack 1, win 0, length 0
07:10:14.934700 IP _gateway.54386 > sepehr.1234: Flags [S], seq 3326609923, win 64240, options [mss 1460,nop,wscale 8,nop,nop,sackOK], length 0
07:10:14.934736 IP sepehr.1234 > _gateway.54386: Flags [R.], seq 0, ack 1, win 0, length 0
07:10:15.219846 IP _gateway.57611 > sepehr.1234: Flags [S], seq 1177338768, win 8192, options [mss 1460,nop,nop,sackOK], length 0
07:10:15.219881 IP sepehr.1234 > _gateway.57611: Flags [R.], seq 0, ack 1, win 0, length 0
07:10:15.221200 IP _gateway.57612 > sepehr.1234: Flags [S], seq 1471742220, win 8192, options [mss 1460,nop,wscale 8,nop,nop,sackOK], length 0
07:10:15.221212 IP sepehr.1234 > _gateway.57612: Flags [R.], seq 0, ack 1471742221, win 0, length 0
07:10:15.449292 IP _gateway.54386 > sepehr.1234: Flags [S], seq 3326609923, win 64240, options [mss 1460,nop,wscale 8,nop,nop,sackOK], length 0
07:10:15.449326 IP sepehr.1234 > _gateway.54386: Flags [R.], seq 0, ack 1, win 0, length 0
07:10:15.723073 IP _gateway.57612 > sepehr.1234: Flags [S], seq 1471742220, win 8192, options [mss 1460,nop,wscale 8,nop,nop,sackOK], length 0
07:10:15.723107 IP sepehr.1234 > _gateway.57612: Flags [R.], seq 0, ack 1, win 0, length 0
07:10:15.963193 IP _gateway.54386 > sepehr.1234: Flags [S], seq 3326609923, win 64240, options [mss 1460,nop,wscale 8,nop,nop,sackOK], length 0
07:10:15.963232 IP sepehr.1234 > _gateway.54386: Flags [R.], seq 0, ack 1, win 0, length 0
07:10:16.223353 IP _gateway.57612 > sepehr.1234: Flags [S], seq 1471742220, win 8192, options [mss 1460,nop,nop,sackOK], length 0
07:10:16.223393 IP sepehr.1234 > _gateway.57612: Flags [R.], seq 0, ack 1, win 0, length 0
07:10:16.224711 IP _gateway.57613 > sepehr.1234: Flags [S], seq 2710349724, win 8192, options [mss 1460,nop,wscale 8,nop,nop,sackOK], length 0
07:10:16.224739 IP sepehr.1234 > _gateway.57613: Flags [R.], seq 0, ack 2710349725, win 0, length 0
07:10:16.478634 IP _gateway.54386 > sepehr.1234: Flags [S], seq 3326609923, win 64240, options [mss 1460,nop,wscale 8,nop,nop,sackOK], length 0
07:10:16.478687 IP sepehr.1234 > _gateway.54386: Flags [R.], seq 0, ack 1, win 0, length 0
07:10:16.480048 IP _gateway.54387 > sepehr.1234: Flags [S], seq 3249854314, win 64240, options [mss 1460,nop,wscale 8,nop,nop,sackOK], length 0
07:10:16.480070 IP sepehr.1234 > _gateway.54387: Flags [R.], seq 0, ack 3249854315, win 0, length 0
07:10:16.725360 IP _gateway.57613 > sepehr.1234: Flags [S], seq 2710349724, win 8192, options [mss 1460,nop,wscale 8,nop,nop,sackOK], length 0
07:10:16.725393 IP sepehr.1234 > _gateway.57613: Flags [R.], seq 0, ack 1, win 0, length 0
07:10:16.991267 IP _gateway.54387 > sepehr.1234: Flags [S], seq 3249854314, win 64240, options [mss 1460,nop,wscale 8,nop,nop,sackOK], length 0
07:10:16.991304 IP sepehr.1234 > _gateway.54387: Flags [R.], seq 0, ack 1, win 0, length 0
07:10:17.226968 IP _gateway.57613 > sepehr.1234: Flags [S], seq 2710349724, win 8192, options [mss 1460,nop,nop,sackOK], length 0
07:10:17.227006 IP sepehr.1234 > _gateway.57613: Flags [R.], seq 0, ack 1, win 0, length 0
07:10:17.228035 IP _gateway.57614 > sepehr.1234: Flags [S], seq 3104721790, win 8192, options [mss 1460,nop,wscale 8,nop,nop,sackOK], length 0
07:10:17.228047 IP sepehr.1234 > _gateway.57614: Flags [R.], seq 0, ack 3104721791, win 0, length 0
07:10:17.493382 IP _gateway.54387 > sepehr.1234: Flags [S], seq 3249854314, win 64240, options [mss 1460,nop,wscale 8,nop,nop,sackOK], length 0
07:10:17.493413 IP sepehr.1234 > _gateway.54387: Flags [R.], seq 0, ack 1, win 0, length 0
07:10:17.590074 IP _gateway.53000 > sepehr.ssh: Flags [P.], seq 1:23, ack 43, win 229, options [nop,nop,TS val 1488769440 ecr 4277071051], length 22
07:10:17.590112 IP sepehr.ssh > _gateway.53000: Flags [.], ack 999, win 503, options [nop,nop,TS val 4277077949 ecr 1488769440], length 0
07:10:17.592020 IP sepehr.ssh > _gateway.53000: Flags [P.], seq 43:1123, ack 999, win 503, options [nop,nop,TS val 4277077951 ecr 1488769440], length 1080
07:10:17.728057 IP _gateway.57614 > sepehr.1234: Flags [S], seq 3104721790, win 8192, options [mss 1460,nop,wscale 8,nop,nop,sackOK], length 0
07:10:17.728094 IP sepehr.1234 > _gateway.57614: Flags [R.], seq 0, ack 1, win 0, length 0
07:10:17.902183 IP _gateway.53000 > sepehr.ssh: Flags [F.], seq 999, ack 43, win 229, options [nop,nop,TS val 1488769751 ecr 4277077949], length 0
07:10:17.903514 IP sepehr.ssh > _gateway.53000: Flags [F.], seq 1123, ack 1000, win 503, options [nop,nop,TS val 4277078262 ecr 1488769751], length 0
07:10:18.004643 IP _gateway.54387 > sepehr.1234: Flags [S], seq 3249854314, win 64240, options [mss 1460,nop,wscale 8,nop,nop,sackOK], length 0
07:10:18.004682 IP sepehr.1234 > _gateway.54387: Flags [R.], seq 0, ack 1, win 0, length 0
07:10:18.008195 ARP, Request who-has 192.168.1.151 tell 192.168.1.150, length 46
07:10:18.228660 IP _gateway.57614 > sepehr.1234: Flags [S], seq 3104721790, win 8192, options [mss 1460,nop,nop,sackOK], length 0
07:10:18.228695 IP sepehr.1234 > _gateway.57614: Flags [R.], seq 0, ack 1, win 0, length 0
07:10:18.230112 IP _gateway.57615 > sepehr.1234: Flags [S], seq 1055571032, win 8192, options [mss 1460,nop,wscale 8,nop,nop,sackOK], length 0
07:10:18.230126 IP sepehr.1234 > _gateway.57615: Flags [R.], seq 0, ack 1055571033, win 0, length 0
07:10:18.516092 IP _gateway.54387 > sepehr.1234: Flags [S], seq 3249854314, win 64240, options [mss 1460,nop,wscale 8,nop,nop,sackOK], length 0
07:10:18.516131 IP sepehr.1234 > _gateway.54387: Flags [R.], seq 0, ack 1, win 0, length 0
07:10:18.517894 IP _gateway.54388 > sepehr.1234: Flags [S], seq 852932477, win 64240, options [mss 1460,nop,wscale 8,nop,nop,sackOK], length 0
07:10:18.517903 IP sepehr.1234 > _gateway.54388: Flags [R.], seq 0, ack 852932478, win 0, length 0
07:10:18.730871 IP _gateway.57615 > sepehr.1234: Flags [S], seq 1055571032, win 8192, options [mss 1460,nop,wscale 8,nop,nop,sackOK], length 0
07:10:18.730905 IP sepehr.1234 > _gateway.57615: Flags [R.], seq 0, ack 1, win 0, length 0
07:10:18.787035 IP _gateway.48704 > sepehr.ssh: Flags [S], seq 2212189632, win 64240, options [mss 1400,sackOK,TS val 2506449508 ecr 0,nop,wscale 7], length 0
07:10:18.787073 IP sepehr.ssh > _gateway.48704: Flags [S.], seq 2806743070, ack 2212189633, win 65160, options [mss 1460,sackOK,TS val 4277079146 ecr 2506449508,nop,wscale 7], length 0
07:10:18.879866 IP _gateway.48704 > sepehr.ssh: Flags [.], ack 1, win 502, options [nop,nop,TS val 2506449601 ecr 4277079146], length 0
07:10:18.879923 IP _gateway.48704 > sepehr.ssh: Flags [P.], seq 1:23, ack 1, win 502, options [nop,nop,TS val 2506449601 ecr 4277079146], length 22
07:10:18.879940 IP sepehr.ssh > _gateway.48704: Flags [.], ack 23, win 509, options [nop,nop,TS val 4277079238 ecr 2506449601], length 0
07:10:18.897249 IP sepehr.ssh > _gateway.48704: Flags [P.], seq 1:43, ack 23, win 509, options [nop,nop,TS val 4277079256 ecr 2506449601], length 42
07:10:18.928560 ARP, Request who-has 192.168.1.151 tell 192.168.1.150, length 46
07:10:18.987717 IP _gateway.48704 > sepehr.ssh: Flags [.], ack 43, win 502, options [nop,nop,TS val 2506449709 ecr 4277079256], length 0
07:10:18.987747 IP sepehr.ssh > _gateway.48704: Flags [P.], seq 43:1123, ack 23, win 509, options [nop,nop,TS val 4277079346 ecr 2506449709], length 1080
07:10:18.987855 IP _gateway.48704 > sepehr.ssh: Flags [P.], seq 23:999, ack 43, win 502, options [nop,nop,TS val 2506449709 ecr 4277079256], length 976
07:10:18.987871 IP sepehr.ssh > _gateway.48704: Flags [.], ack 999, win 502, options [nop,nop,TS val 4277079346 ecr 2506449709], length 0
07:10:19.032690 IP _gateway.54388 > sepehr.1234: Flags [S], seq 852932477, win 64240, options [mss 1460,nop,wscale 8,nop,nop,sackOK], length 0
07:10:19.032719 IP sepehr.1234 > _gateway.54388: Flags [R.], seq 0, ack 1, win 0, length 0
07:10:19.081110 IP _gateway.48704 > sepehr.ssh: Flags [P.], seq 999:1047, ack 1123, win 501, options [nop,nop,TS val 2506449802 ecr 4277079346], length 48
07:10:19.081158 IP sepehr.ssh > _gateway.48704: Flags [.], ack 1047, win 502, options [nop,nop,TS val 4277079440 ecr 2506449802], length 0
07:10:19.088869 IP sepehr.ssh > _gateway.48704: Flags [P.], seq 1123:1559, ack 1047, win 502, options [nop,nop,TS val 4277079447 ecr 2506449802], length 436
07:10:19.181943 IP _gateway.48704 > sepehr.ssh: Flags [P.], seq 1047:1063, ack 1559, win 501, options [nop,nop,TS val 2506449903 ecr 4277079447], length 16
07:10:19.181977 IP sepehr.ssh > _gateway.48704: Flags [.], ack 1063, win 502, options [nop,nop,TS val 4277079540 ecr 2506449903], length 0
07:10:19.231330 IP _gateway.57615 > sepehr.1234: Flags [S], seq 1055571032, win 8192, options [mss 1460,nop,nop,sackOK], length 0
07:10:19.231357 IP sepehr.1234 > _gateway.57615: Flags [R.], seq 0, ack 1, win 0, length 0
07:10:19.232673 IP _gateway.57616 > sepehr.1234: Flags [S], seq 1094171195, win 8192, options [mss 1460,nop,wscale 8,nop,nop,sackOK], length 0
07:10:19.232692 IP sepehr.1234 > _gateway.57616: Flags [R.], seq 0, ack 1094171196, win 0, length 0
